{"schema":"daee-topology-capacity-spec-v1","seed":466001,"dimensions":{"input_observations":3,"input_pressures":3,"candidate_states":3,"candidate_hyperedges":2,"baseline_burdens":3,"submoves_per_burden":3,"held_baseline_burdens":0,"generated_burdens":0,"generation_depth":0,"preempted_candidates":0,"route_candidate_kinds":["loopbreak"]},"dependency_shape":"noetic-cycle-loopbreak","closure_policy":"complete-when-no-live-obligations"}
