{"schema":"daee-topology-capacity-spec-v1","seed":460208,"dimensions":{"input_observations":20,"input_pressures":20,"candidate_states":4,"candidate_hyperedges":2,"baseline_burdens":20,"submoves_per_burden":8,"held_baseline_burdens":0,"generated_burdens":0,"generation_depth":0,"preempted_candidates":0,"route_candidate_kinds":["direct"]},"dependency_shape":"fan-out","closure_policy":"complete-when-no-live-obligations"}
