{"schema":"daee-topology-capacity-spec-v1","seed":461006,"dimensions":{"input_observations":12,"input_pressures":12,"candidate_states":4,"candidate_hyperedges":3,"baseline_burdens":10,"submoves_per_burden":6,"held_baseline_burdens":1,"generated_burdens":2,"generation_depth":2,"preempted_candidates":1,"route_candidate_kinds":["direct","generated","synthetic-unclassified-x"]},"dependency_shape":"mixed","closure_policy":"partial-with-live-obligations"}
