{"schema":"daee-topology-capacity-spec-v1","seed":463001,"dimensions":{"input_observations":2,"input_pressures":2,"candidate_states":2,"candidate_hyperedges":1,"baseline_burdens":1,"submoves_per_burden":3,"held_baseline_burdens":0,"generated_burdens":3,"generation_depth":3,"preempted_candidates":0,"route_candidate_kinds":["generated"]},"dependency_shape":"generated-chain","closure_policy":"complete-when-no-live-obligations"}
